{
  "$schema": "https://json-schema.org/draft/2020-12/schema",
  "$id": "https://raw.githubusercontent.com/conuti-gmbh/bo4e-schema-en/main/schemas/v1/bo/StatusNotification.schema.json",
  "title": "StatusNotification",
  "type": "object",
  "properties": {
    "boType": {
      "$ref": "../enum/BOType.schema.json",
      "default": "STATUS_NOTIFICATION"
    },
    "structureVersion": {
      "type": "string",
      "default": "1"
    },
    "statusObject": {
      "$ref": "../enum/StatusObject.schema.json"
    },
    "statusOccasion": {
      "$ref": "../enum/Status.schema.json"
    },
    "orderStatus": {
      "$ref": "../enum/OrderStatus.schema.json"
    },
    "positionData": {
      "type": [
        "array",
        "null"
      ],
      "items": {
        "$ref": "../com/StatusNotificationPosition.schema.json"
      }
    }
  },
  "required": [
    "boType",
    "structureVersion"
  ]
}